{
  "$schema": "http://json-schema.org/draft-07/schema#",
  "title": "THEME",
  "description": "Тема книги.",
  "type": "object",
  "required": ["id", "name", "description"],
  "properties": {
    "id": {"type": "string", "pattern": "^theme_[0-9]+$"},
    "name": {"type": "string"},
    "description": {"type": "string"},
    "chapters": {"type": "array", "items": {"type": "integer"}},
    "strength": {"type": "number", "minimum": 0, "maximum": 1}
  }
}
