[
  {
    "id": "val_070",
    "name": "Гармония",
    "description": "Баланс человека с природой и космосом",
    "strength": 0.9
  },
  {
    "id": "val_069",
    "name": "Ответственность",
    "description": "Ответственность за свой народ и планету",
    "strength": 0.9
  },
  {
    "id": "val_068",
    "name": "Память",
    "description": "Сохранение памяти предков",
    "strength": 0.9
  },
  {
    "id": "val_067",
    "name": "Служение",
    "description": "Служение общему благу и эволюции",
    "strength": 0.9
  },
  {
    "id": "val_066",
    "name": "Преемственность",
    "description": "Передача знаний и традиций",
    "strength": 0.9
  },
  {
    "id": "val_065",
    "name": "Истина",
    "description": "Поиск истины — главная движущая сила",
    "strength": 0.9
  },
  {
    "id": "val_001",
    "name": "Предыстория",
    "description": "Таинственная, загадочная и сокрытая часть истории, предшествующая современному человечеству.",
    "strength": 0.6
  },
  {
    "id": "val_002",
    "name": "Культурное наследие",
    "description": "Часть исторического наследия, которая была утрачена или скрыта, но может быть восстановлена через расшифровку преистории.",
    "strength": 0.6
  },
  {
    "id": "val_003",
    "name": "Свобода от догм",
    "description": "Возможность освободиться от общепринятых научных и культурных догм для получения нового взгляда на историю и развитие человечества.",
    "strength": 0.6
  },
  {
    "id": "val_004",
    "name": "Иная позиция миропонимания",
    "description": "Подход к пониманию прошлого и будущего, основанный не на традиционных знаниях, а на внутреннем свете души и истине.",
    "strength": 0.6
  },
  {
    "id": "val_005",
    "name": "Водные артерии",
    "description": "Гипербореи активно использовали водные пути для передвижения.",
    "strength": 0.6
  },
  {
    "id": "val_006",
    "name": "Воздухоплавание",
    "description": "Были разработаны технологии воздухоплавания для перемещения.",
    "strength": 0.6
  },
  {
    "id": "val_007",
    "name": "Снегоходные средства",
    "description": "Созданы разнообразные снегоходные устройства из лёгких материалов для использования зимой.",
    "strength": 0.6
  },
  {
    "id": "val_008",
    "name": "Механические и энергетические установки",
    "description": "Использовались различные виды установок для приведения в движение транспортных средств.",
    "strength": 0.6
  },
  {
    "id": "val_009",
    "name": "Контроль над гравитацией",
    "description": "Гипербореи умели изменять вес объектов с помощью звуковых воздействий, преодолевая гравитацию.",
    "strength": 0.6
  },
  {
    "id": "val_010",
    "name": "Осмысленное поселение",
    "description": "Жители селились в местах с благоприятной жизненной энергией Земли, учитывали расположение небесных тел при выборе мест проживания.",
    "strength": 0.6
  },
  {
    "id": "val_011",
    "name": "Архитектура и дизайн",
    "description": "Элегантные деревянные здания строились в садах с использованием особых методов обработки древесины.",
    "strength": 0.6
  },
  {
    "id": "val_012",
    "name": "Ландшафтная энергетика",
    "description": "Горные и водные ландшафты влияли на формирование культуры и характера жителей.",
    "strength": 0.6
  },
  {
    "id": "val_013",
    "name": "Перемещение и временное проживание",
    "description": "Семья регулярно меняла место жительства, оставляя территорию восстановиться после их пребывания.",
    "strength": 0.6
  },
  {
    "id": "val_014",
    "name": "Доверительные отношения",
    "description": "Общество строилось на взаимопонимании и равенстве удовлетворения потребностей.",
    "strength": 0.6
  },
  {
    "id": "val_015",
    "name": "Связь с природой и космосом",
    "description": "Жители признавали неразрывную связь между человеком, природой и космосом, следуя указаниям наставников.",
    "strength": 0.6
  },
  {
    "id": "val_016",
    "name": "Роль женщины",
    "description": "Женщины играли ключевую роль в поддержании порядка в обществе, воспитании детей и создании гармоничной атмосферы.",
    "strength": 0.6
  },
  {
    "id": "val_017",
    "name": "Единая истина",
    "description": "Все учения являются различными проявлениями единой истины, адаптированной к каждому историческому периоду.",
    "strength": 0.6
  },
  {
    "id": "val_018",
    "name": "Служение истине",
    "description": "Последователи учения посвящают свою жизнь служению истине и высшим идеалам ради блага всего человечества.",
    "strength": 0.6
  },
  {
    "id": "val_019",
    "name": "Учение Истины",
    "description": "Великосвет (Велиусмус) много лет изучает и практикует учение истины, что приводит его к глубоким знаниям и духовным открытиям.",
    "strength": 0.6
  },
  {
    "id": "val_020",
    "name": "Путешествие и познание",
    "description": "Великосвет путешествует по всей стране, обучаясь у различных людей и получая глубокие знания о мире и человечестве.",
    "strength": 0.6
  },
  {
    "id": "val_021",
    "name": "Личная передача знаний",
    "description": "Он перенимает знания напрямую от посвященных, становясь частью традиции передачи мудрости.",
    "strength": 0.6
  },
  {
    "id": "val_022",
    "name": "Развитие внутренних сил",
    "description": "Великосвет развивает свои психические способности и трансформирует свое тело, следуя пути внутреннего преображения.",
    "strength": 0.6
  },
  {
    "id": "val_023",
    "name": "Служение общему благу",
    "description": "Его путь направлен на пользу всему человечеству, стремясь к общей эволюции и просветлению.",
    "strength": 0.6
  },
  {
    "id": "val_024",
    "name": "Духовное совершенствование",
    "description": "Через преодоление испытаний и овладение собой, Великосвет достигает духовного совершенства и становится сознательным творцом своей судьбы.",
    "strength": 0.6
  },
  {
    "id": "val_025",
    "name": "Связь с Учителем",
    "description": "Соприкасаясь с общими истоками мудрости, Великосвет приближается к пониманию учителя, хотя осознает сложность полного понимания его сущности.",
    "strength": 0.6
  },
  {
    "id": "val_026",
    "name": "Связь с Высшим Миром",
    "description": "Построение моста между Высшим Миром и человеком",
    "strength": 0.6
  },
  {
    "id": "val_027",
    "name": "Постоянное присутствие",
    "description": "Мост всегда присутствует в жизни искателя истины",
    "strength": 0.6
  },
  {
    "id": "val_028",
    "name": "Поддержка и советы",
    "description": "Возможность получать необходимую помощь, советы и поддержку при любых жизненных трудностях",
    "strength": 0.6
  },
  {
    "id": "val_029",
    "name": "Духовность",
    "description": "Ориентация на духовные основы и нравственность.",
    "strength": 0.6
  },
  {
    "id": "val_030",
    "name": "Самообладание",
    "description": "Контроль над мыслями, чувствами и эмоциями.",
    "strength": 0.6
  },
  {
    "id": "val_031",
    "name": "Терпимость",
    "description": "Способность понимать и принимать других людей.",
    "strength": 0.6
  },
  {
    "id": "val_032",
    "name": "Справедливость",
    "description": "Постоянное соблюдение принципа справедливости в любых взаимоотношениях.",
    "strength": 0.6
  },
  {
    "id": "val_033",
    "name": "Доброжелательность",
    "description": "Искреннее стремление делать добро окружающим людям.",
    "strength": 0.6
  },
  {
    "id": "val_034",
    "name": "Жертвенность",
    "description": "Готовность жертвовать личными интересами ради общего блага.",
    "strength": 0.6
  },
  {
    "id": "val_035",
    "name": "Смирение",
    "description": "Умение принимать ситуацию такой, какая она есть, без сопротивления.",
    "strength": 0.6
  },
  {
    "id": "val_036",
    "name": "Стойкость",
    "description": "Готовность переносить трудности и испытания, принимая страдания как способ самосовершенствования.",
    "strength": 0.6
  },
  {
    "id": "val_037",
    "name": "Архитектурное наследие",
    "description": "Сходство малых городов с проектом Славного и его сподвижников.",
    "strength": 0.6
  },
  {
    "id": "val_038",
    "name": "Духовная преемственность",
    "description": "Наследие Гипербореи является основой для создания новой Страны Городов.",
    "strength": 0.6
  },
  {
    "id": "val_039",
    "name": "Символизм расположения городов",
    "description": "Хаотичное расположение городов скрывает глубокий смысл и продуманность Учителя.",
    "strength": 0.6
  },
  {
    "id": "val_040",
    "name": "Катастрофическое прошлое и выживание",
    "description": "Северяне сохранили свою культуру после глобальных катастроф и испытаний.",
    "strength": 0.6
  },
  {
    "id": "val_041",
    "name": "Роль потомства в сохранении культуры",
    "description": "Дети становятся хранителями знаний и ценностей, передавая их будущим поколениям.",
    "strength": 0.6
  },
  {
    "id": "val_042",
    "name": "Формирование фундамента для будущего",
    "description": "Подготовка детей к передаче культурных и духовных ценностей следующему поколению.",
    "strength": 0.6
  },
  {
    "id": "val_043",
    "name": "Нравственная ценность семьи",
    "description": "Высокая значимость семьи и важности её укрепления через любовь и взаимопонимание.",
    "strength": 0.6
  },
  {
    "id": "val_044",
    "name": "Любовь и красота",
    "description": "Истинная, постоянная и возвышенная любовь является источником красоты и высшего счастья.",
    "strength": 0.6
  },
  {
    "id": "val_045",
    "name": "Ответственное родительство",
    "description": "Родители стремятся передать детям лучшие качества, знания и опыт, заботятся о благоприятном окружении и воспитывают гармонично развитое поколение.",
    "strength": 0.6
  },
  {
    "id": "val_046",
    "name": "Роль наставничества",
    "description": "Наставники помогают молодёжи развиваться, наблюдать за молодыми парами и поддерживать их на пути к созданию семьи.",
    "strength": 0.6
  },
  {
    "id": "val_047",